Requirement,Context (Keywords),Name of Doc,Sec/NotSec,Labeled by,Comments,Label,Labeled by,Comments,,,,,,
2)maintain the security of organisational information processing facilities and information assets accessed by third parties; and,OPERATIONAL,ehr_priv_sec,1,Riaz,,Operational,Vasily,,,,,,,
3)maintain the security of information when the responsibility for information processing has been outsourced to another organisation.,OPERATIONAL,ehr_priv_sec,1,Riaz,,Operational,Vasily,,,,,,,
a) clearly define and assign information security responsibilities; and,MANAGEMENT,ehr_priv_sec,1,Riaz,,Operational,Vasily,,,,,,,
b) ensure that Information security activities relating to the EHRi are co-ordinated by representatives from different parts of the organisation who have relevant roles and job functions.,MANAGEMENT,ehr_priv_sec,1,Riaz,,Operational,Vasily,,,,,,,
-performing security assessments and evaluating the organisation's information security risks (see Security Requirement 1);,MANAGEMENT,ehr_priv_sec,1,Riaz,,Operational,Vasily,,,,,,,
-developing appropriate security policies (see Security Requirement 2);,MANAGEMENT,ehr_priv_sec,1,Riaz,,Operational,Vasily,,,,,,,
"-architecting, implementing and monitoring an enterprise wide information security program ensuring the confidentiality, integrity, and availability of information and the integrity and availability of systems;",MANAGEMENT,ehr_priv_sec,1,Riaz,,Operational,Vasily,,,,,,,
-developing and implementing security awareness training programs (see Security Requirement 16);,OPERATIONAL,ehr_priv_sec,1,Riaz,,Operational,Vasily,,,,,,,
"-assessing, building and managing an effective information security department ;",MANAGEMENT,ehr_priv_sec,1,Riaz,,Operational,Vasily,,,,,,,
-managing expense budgets for IT security services and capital expenditures;,MANAGEMENT,ehr_priv_sec,1,Riaz,,Operational,Vasily,,,,,,,
"-establishing protocols to proactively test and protect the integrity, confidentiality, and availability of information enterprise wide within the context of the organisation's privacy and security policies;",MANAGEMENT,ehr_priv_sec,1,Riaz,,Operational,Vasily,,,,,,,
-maintaining effective business continuity and disaster recovery plans (see Security Requirement 86); and,MANAGEMENT,ehr_priv_sec,1,Riaz,,Operational,Vasily,,,,,,,
Organisations connecting to the EHRi or hosting components of the EHRi must have the implementation of their information security policy either: a) reviewed independently; or b) attested to in a written declaration by the organisation�s chief executive officer or board of directors.,MANAGEMENT,ehr_priv_sec,1,Riaz,,Operational,Vasily,,,,,,,
PHI flowing from one jurisdiction to another must do so in an environment where a minimum level of protection is afforded regardless of which jurisdiction the information finds itself.,CONFIDENTIALITY,ehr_priv_sec,1,Riaz,,Confidentiality,Vasily,,,,,,,
"Third party review can and should occur at many levels: policy reviews, organisational IT security reviews, EHRi-wide Threat and Risk Assessments, TRAs for specific systems, security architecture reviews, technical system testing such as vulnerability testing, and compliance audits against policies and procedures.",MANAGEMENT,ehr_priv_sec,1,Riaz,,Operational,Vasily,,,,,,,
"Organisations hosting components of the EHRi must assess, by means of threat and risk analysis, the risks associated with access by external parties to hosted components or to facilities management by external parties and must implement appropriate security controls where necessary to mitigate identified risks.",MANAGEMENT,ehr_priv_sec,1,Riaz,,Operational,Vasily,,,,,,,
a) outsourcing management or control of all or some part of EHRi hosted components;,MANAGEMENT,ehr_priv_sec,1,Riaz,,Operational,Vasily,,,,,,,
b) third-party facilities management for EHRi hosted components; or.,MANAGEMENT,ehr_priv_sec,1,Riaz,,Operational,Vasily,,,,,,,
c) access to the EHRi by third parties.,MANAGEMENT,ehr_priv_sec,1,Riaz,,Operational,Vasily,,,,,,,
The objectives of information asset management is to achieve and maintain appropriate protection of organisational assets.,MANAGEMENT,ehr_priv_sec,1,Riaz,,Operational,Vasily,,,,,,,
"c)have rules governing the acceptable use of these assets that are identified, documented, and put into practice.",MANAGEMENT,ehr_priv_sec,1,Riaz,,Operational,Vasily,,,,,,,
Because one cannot predict the sensitivity of a given element of PHI through all its uses and phases of its life cycle that all PHI should be subject to careful protection at all times.,PRIVACY,ehr_priv_sec,1,Riaz,,Confidentiality,Vasily,,,,,,,
Identifying and (where appropriate) protectively labelling information assets as confidential can be an important tool in staff training and awareness.,CONFIDENTIALITY,ehr_priv_sec,1,Riaz,,Confidentiality,Vasily,,,,,,,
All data contained within a patient or person's EHR is to be considered confidential and its confidentiality uniformly protected.,CONFIDENTIALITY,ehr_priv_sec,1,Riaz,,Confidentiality,Vasily,,,,,,,
"This is especially important where the information is contained in email, faxes or other documents which may contain a mixture of confidential and non-confidential information.",CONFIDENTIALITY,ehr_priv_sec,1,Riaz,,Confidentiality,Vasily,,,,,,,
"1)reduce risks of human error, theft, fraud or misuse of facilities;",OPERATIONAL,ehr_priv_sec,1,Riaz,,Operational,Vasily,,,,,,,
"2)ensure that users are aware of information security threats and concerns, and are equipped to support the corporate security policy in the course of their normal work;",OPERATIONAL,ehr_priv_sec,1,Riaz,,Operational,Vasily,,,,,,,
3)minimize the damage from security incidents and malfunctions; and,OPERATIONAL,ehr_priv_sec,1,Riaz,,Operational,Vasily,,,,,,,
"All organisations connecting to the EHRi or hosting components of the EHRi should document in job definitions the security roles and responsibilities of staff who are registered users of healthcare applications accessible via the EHRi, as laid down in the organisation�s information security policy.",MANAGEMENT,ehr_priv_sec,1,Riaz,,Operational,Vasily,,,,,,,
These roles must be defined in a standardised or harmonized manner so as to ensure future interoperability of authentication services between POS systems and the EHRi.,"MANAGEMENT,CONFIDENTIALITY",ehr_priv_sec,1,Riaz,,Access control,Vasily,,,,,,,
"All organisations connecting to the EHRi or hosting components of the EHRi must include in the terms and conditions of employment of employees (permanent, part-time or contracted) who are, or will be, users of POS systems connected to the EHRi, a statement about the employee�s responsibility for information security and privacy.",MANAGEMENT,ehr_priv_sec,1,Riaz,,Operational?,Vasily,Accountability?,,,,,,
Terms of Employment involving maintaining confidentiality should survive employment termination (see provisions for confidentiality agreements in Security Requirement 15).,MANAGEMENT,ehr_priv_sec,1,Riaz,,Operational?,Vasily,Accountability?,,,,,,
All organisations hosting components of the EHRi or connecting to the EHRi must verify the identity and address of each permanent or temporary staff member or contractor who will become a registered user of a POS connected to the EHRi or who will have access to hosted components of the EHRi.,OPERATIONAL,ehr_priv_sec,1,Riaz,,Operational?,Vasily,Accountability?,,,,,,
A simple verification of name and address from reliable identification documents (driver's license for example) suffices to meet the requirement.,OPERATIONAL,ehr_priv_sec,1,Riaz,,Operational?,Vasily,Accountability?,,,,,,
"Such verification of identity documents helps to ensure that effective prosecution or litigation can be brought against individuals who can be shown, as a result of analyzing audit logs, to have abused their access privileges.",OPERATIONAL,ehr_priv_sec,1,Riaz,,Operational?,Vasily,Accountability?,,,,,,
All organisations hosting components of the EHRi or connecting to the EHRi must obtain a signed confidentiality agreement from each permanent or temporary staff member or contractor who is a registered user of a POS connected to the EHRi or who has access to hosted components of the EHRi as part of his or her initial terms and conditions of employment.,MANAGEMENT,ehr_priv_sec,1,Riaz,,Operational,Vasily,,,,,,,
Confidentiality agreements need to be carefully worded to comply with jurisdictional requirements.,MANAGEMENT,ehr_priv_sec,1,Riaz,,Operational,Vasily,,,,,,,
All organisations hosting components of the EHRi or connecting to the EHRi must ensure that information security education and training and regular updates in organisational security policies and procedures are provided to each permanent or temporary employee or third-party contractor who is a registered user of a POS connected to the EHRi or who has access to hosted components of the EHRi.,OPERATIONAL,ehr_priv_sec,1,Riaz,,Operational,Vasily,,,,,,,
"All users need to be made aware of the confidentiality of PHI, and the procedures required for maintaining this confidentiality.",OPERATIONAL,ehr_priv_sec,1,Riaz,,Operational,Vasily,,,,,,,
"As well, users should be made aware of the importance of maintaining the confidentiality of information that refers to identifiable healthcare providers.",OPERATIONAL,ehr_priv_sec,1,Riaz,,Operational,Vasily,,,,,,,
"Rationale:  Effective termination of user access privileges is a minimum requirement but in the absence of single sign-on capabilities and shared authentication services, it is not always effectually handled.",CONFIDENTIALITY,ehr_priv_sec,1,Riaz,,Access control,Vasily,,,,,,,
"Termination of user access privileges will also include termination of digital signatures (see ""Security Requirement 79  Providing Digital Signatures for Users"").",CONFIDENTIALITY,ehr_priv_sec,1,Riaz,,Access control,Vasily,,,,,,,
"1)prevent unauthorized access, damage and interference to business premises and information;",OPERATIONAL,ehr_priv_sec,1,Riaz,,Integrity,Vasily,,,,,,,
"2)prevent loss, damage or compromise of assets and interruption to business activities; and",OPERATIONAL,ehr_priv_sec,1,Riaz,,Availability,Vasily,,,,,,,
3)prevent compromise or theft of information and information processing facilities.,OPERATIONAL,ehr_priv_sec,1,Riaz,,Confidentiality,Vasily,,,,,,,
"All organisations hosting components of the EHRi must use security perimeters to protect areas that contain information processing facilities supporting EHRi servers, applications or data.",OPERATIONAL,ehr_priv_sec,1,Riaz,,Operational,Vasily,,,,,,,
These secure areas must be protected by appropriate entry controls to ensure that only authorized personnel are allowed access.,OPERATIONAL,ehr_priv_sec,1,Riaz,,Operational,Vasily,,,,,,,
Rationale:  Perimeter security of servers and other aspects of application hosting is a minimum requirement for ensuring the availability and integrity of these important applications and data and for ensuring the confidentiality of information in storage that is not already secured cryptographically.,"CONFIDENTIALITY,INTEGRITY,AVAILABILITY",ehr_priv_sec,1,Riaz,,Operational,Vasily,,,,,,,
"In turn, controlling access is a minimum requirement of perimeter security.",OPERATIONAL,ehr_priv_sec,1,Riaz,,Operational,Vasily,,,,,,,
"The most detailed provisions are found in Manitoba�s health information legislation, which require the trustee to ensure that PHI is maintained in a designated area or areas that is subject to appropriate security safeguards; and to limit physical access to designated areas to authorized persons.",OPERATIONAL,ehr_priv_sec,1,Riaz,,Operational,Vasily,,,,,,,
All organisations hosting components of the EHRi must protect sites and equipment supporting the EHRi to reduce the risks from environmental threats and hazards.,OPERATIONAL,ehr_priv_sec,1,Riaz,,Operational,Vasily,,,,,,,
All organisations hosting components of the EHRi must protect equipment supporting the EHRi from power failures and other disruptions caused by failures in supporting utilities.,OPERATIONAL,ehr_priv_sec,1,Riaz,,Availability,Vasily,,,,,,,
Rationale:  This is a minimum requirement for protecting system availability in the 24 by 7 operational environment of healthcare.,AVAILABILITY,ehr_priv_sec,1,Riaz,,Availability,Vasily,,,,,,,
"Healthcare demands high system availability, especially in those instances where disruptions of supporting utilities are caused by disasters that themselves result in injuries and therefore place a heavy burden on emergency health services.",AVAILABILITY,ehr_priv_sec,1,Riaz,,Availability,Vasily,,,,,,,
"All organisations hosting components of the EHRi must ensure that equipment supporting the EHRi: 1) is not used outside their premises without appropriate safeguards and prior authorization by the organisation's management, and 2) is repaired or serviced by authorized personnel only.",OPERATIONAL,ehr_priv_sec,1,Riaz,,Operational,Vasily,,,,,,,
"All organisations hosting components of the EHRi or connecting to the EHRi must securely overwrite or else destroy all media containing EHRi application software, PHI, or security critical system data when no longer required for use.",OPERATIONAL,ehr_priv_sec,1,Riaz,,Confidentiality,Vasily,,,,,,,
Legal requirements follow from the Manitoba regulations pursuant to Personal Health Information Act: �to ensure the security of PHI in electronic form when the computer hardware or removable electronic storage media on which it has been recorded is being disposed of or used for another purpose�.,OPERATIONAL,ehr_priv_sec,1,Riaz,,Confidentiality,Vasily,,,,,,,
"All organisations hosting components of the EHRi must not allow equipment, data or software supporting the EHRi to be removed without authorization by the organisation's management.",OPERATIONAL,ehr_priv_sec,1,Riaz,,Operational,Vasily,,,,,,,
1)ensure the correct and secure operation of information processing facilities;,CONFIDENTIALITY,ehr_priv_sec,1,Riaz,,Confidentiality,Vasily,,,,,,,
2)minimize the risk of systems failures;,OPERATIONAL,ehr_priv_sec,1,Riaz,,Availability,Vasily,,,,,,,
3)protect the integrity of software and information;,INTEGRITY,ehr_priv_sec,1,Riaz,,Integrity,Vasily,,,,,,,
4)maintain the integrity and availability of information processing and communication;,"OPERATIONAL,INTEGRITY,AVAILABILITY",ehr_priv_sec,1,Riaz,,Other,Vasily,"Integrity and availability in same place, weird choice",,,,,,
5)ensure the safeguarding of information in networks and the protection of the supporting infrastructure;,"OPERATIONAL,CONFIDENTIALITY",ehr_priv_sec,1,Riaz,,Confidentiality,Vasily,,,,,,,
6)prevent damage to assets and interruptions to business activities; and,"AVAILABILITY_SURVIVABILITY,OPERATIONAL",ehr_priv_sec,1,Riaz,,Integrity,Vasily,,,,,,,
"7)prevent loss, modification or misuse of information exchanged between organisations.","CONFIDENTIALITY,INTEGRITY,OPERATIONAL,MANAGEMENT",ehr_priv_sec,1,Riaz,,Integrity,Vasily,,,,,,,
All organisations hosting components of the EHRi must control changes to information processing facilities and systems that support the EHRi by means of a formal and structured change control process to ensure the appropriate control of host applications and systems.,OPERATIONAL,ehr_priv_sec,1,Riaz,,Operational,Vasily,,,,,,,
All organisations hosting components of the EHRi must separate the development and testing environments for those EHRi components from the operational environments for those components.,OPERATIONAL,ehr_priv_sec,1,Riaz,,Operational,Vasily,,,,,,,
All organisations hosting components of the EHRi must monitor capacity demands and project future capacity requirements to ensure adequate processing power and storage will be made available to host those EHRi components.,OPERATIONAL,ehr_priv_sec,1,Riaz,,Operational,Vasily,,,,,,,
"All organisations hosting components of the EHRi or connecting to the EHRi must implement appropriate detection and prevention controls and appropriate user awareness procedures to protect against malicious software (viruses, worms, etc.)","OPERATIONAL,INTEGRITY_IMMUNITY",ehr_priv_sec,1,Riaz,,Operational,Vasily,,,,,,,
"Security Requirement 30  Securely Backing Up Data All organisations hosting components of the EHRi must back up PHI and security critical system data in a manner that ensures the confidentiality, integrity, and availability of the data ; and b) store the backed-up data in a physically secure environment off-site (see section 5.7).",OPERATIONAL,ehr_priv_sec,1,Riaz,,Operational?,Vasily,Might be integrity or availability bacause it is about back ups.,,,,,,
Manitoba�s health information legislation requires a trustee who uses electronic means to request disclosure and to respond to requests for disclosure to implement procedures to prevent the interception of information by unauthorized persons.,CONFIDENTIALITY,ehr_priv_sec,1,Riaz,,Confidentiality,Vasily,,,,,,,
"All organisations hosting components of the EHRi must  � and organisations connecting to the EHRi should � ensure that PHI and other security critical data stored on removable media are: a) encrypted while the media are in transit to protect the data's confidentiality and integrity; and  Admin Requirement  Tech  Requirement b) protected from theft, where appropriate, while the media are in transit to  protect the data's availability.","AVAILABILITY,OPERATIONAL",ehr_priv_sec,1,Riaz,,Confidentiality?,Vasily,"A bloody mess, probably shoud delete it",,,,,,
"All organisations connecting to the EHRi or hosting components of the EHRi should destroy, permanently erase or make anonymous PHI contained on media that are no longer required.",OPERATIONAL,ehr_priv_sec,1,Riaz,,Confidentiality?,Vasily,Might be operational,,,,,,
"All organisations hosting components of the EHRi must protect electronic media containing PHI or security critical system data, including user registration data, by one or more of the following means:",OPERATIONAL,ehr_priv_sec,1,Riaz,,Operational,Vasily,,,,,,,
a) physically protecting the media in accordance with Security Requirement 18;,OPERATIONAL,ehr_priv_sec,1,Riaz,,Confidentiality,Vasily,,,,,,,
b) securely de-identifying the PHI it contains; or,"OPERATIONAL,PRIVACY",ehr_priv_sec,1,Riaz,,Confidentiality,Vasily,,,,,,,
c) encrypting the data it contains.,CONFIDENTIALITY,ehr_priv_sec,1,Riaz,,Confidentiality,Vasily,,,,,,,
Protection of user registration data is essential to maintaining its integrity (and hence the integrity of the user authentication process).,INTEGRITY,ehr_priv_sec,1,Riaz,,Integrity,Vasily,,,,,,,
"While physical protection of data storage will always be essential (to protect system availability), de-identification and encryption should be seriously considered in the design of any new system.","OPERATIONAL,CONFIDENTIALITY,PRIVACY",ehr_priv_sec,1,Riaz,,Confidentiality,Vasily,,,,,,,
"All organisations hosting components of the EHRi must monitor the status and location of media containing unencrypted EHRi data or security critical data, including user registration data, and ensure this data remains physically protected.",OPERATIONAL,ehr_priv_sec,1,Riaz,,Operational,Vasily,,,,,,,
Information exchange agreements should be executed between (among) jurisdictions operating EHRi components prior to PHI flowing across provincial or territorial borders.,MANAGEMENT,ehr_priv_sec,1,Riaz,,Operational,Vasily,,,,,,,
Such agreements would clarify the mutual custodial responsibilities of jurisdictions with relation to PHI.,MANAGEMENT,ehr_priv_sec,1,Riaz,,Operational,Vasily,,,,,,,
"Of all security requirements protecting PHI, one of the most important is audit and logging.",ACCOUNTABILITY,ehr_priv_sec,1,Riaz,,Accountability,Vasily,,,,,,,
These ensure accountability for patients or persons entrusting their information to electronic health record systems and also ensure that users will conform to policies on acceptable use of the EHRi.,ACCOUNTABILITY,ehr_priv_sec,1,Riaz,,Accountability,Vasily,,,,,,,
"Audit records should contain the necessary information to answer the following questions: 1)For a given user, what PHI did they access, create or update and when? 2)or a given element of PHI, what users have accessed, created or updated it and when?",ACCOUNTABILITY,ehr_priv_sec,1,Riaz,,Accountability,Vasily,,,,,,,
"1) A trustee shall ensure every electronic information system that the trustee designs or acquires after December 11, 2000: a) produces an electronic record of every successful or unsuccessful attempt to i) gain access to the personal health information maintained on the system, ii) add to, delete or modify the personal health information maintained on the system; and",ACCOUNTABILITY,ehr_priv_sec,1,Riaz,,Accountability,Vasily,"list, corrupted",,,,,,
"To construct an authoritative transcript of which users have accessed a patient or person�s PHI or what PHI a user has accessed, all audit records will need to be accessible and hence audit requirements meeting the strictest existing jurisdictional legal requirements are essential to support full interoperability across jurisdictions.","AVAILABILITY,ACCOUNTABILITY",ehr_priv_sec,1,Riaz,,Accountability,Vasily,,,,,,,
Rationale:  Such an audit log allows reconstruction of the state of any EHR stored within the POS system at any point in time.,"AVAILABILITY,INTEGRITY",ehr_priv_sec,1,Riaz,,Integrity?,Vasily,Is version control part of accountability or integrity?,,,,,,
The EHRi may be required to keep a record of all cross-jurisdictional transfers of PHI.,ACCOUNTABILITY,ehr_priv_sec,1,Riaz,,Accountability,Vasily,,,,,,,
"For example, Alberta�s health information legislation requires a custodian that discloses PHI to make a note of the name of the person to whom the custodian disclosed the information; the date and purpose of the disclosure; and a description of the information disclosed.","CONFIDENTIALITY,ACCOUNTABILITY",ehr_priv_sec,1,Riaz,,Accountability,Vasily,part of example,,,,,,
"All POS systems connected to the EHRi must record in an audit log every instance of a user accessing, updating, or archiving PHI.",ACCOUNTABILITY,ehr_priv_sec,1,Riaz,,Accountability,Vasily,,,,,,,
"All organisations hosting components of the EHRi or connecting to the EHRi must retain75 the audit log for the entire retention period of the records audited, to enable investigations to be carried out when necessary and to provide evidence where necessary.","AVAILABILITY,OPERATIONAL,ACCOUNTABILITY",ehr_priv_sec,1,Riaz,,Accountability,Vasily,,,,,,,
Rationale:  This requirement mandates that automated tools actively look for anomalous patterns of access.,ACCOUNTABILITY,ehr_priv_sec,1,Riaz,,Accountability,Vasily,,,,,,,
Such active intrusion detection is an essential feature of robust security systems.,ACCOUNTABILITY,ehr_priv_sec,1,Riaz,,Accountability,Vasily,,,,,,,
"Unlike audit logging itself, the analysis tools need not be continuously available.","AVAILABILITY,ACCOUNTABILITY",ehr_priv_sec,1,Riaz,,Availability?,Vasily,Might be accountability,,,,,,
It suffices that such tools be available when needed.,AVAILABILITY,ehr_priv_sec,1,Riaz,,Availability,Vasily,,,,,,,
Need will be determined by system design and by appropriate Threat and Risk Analysis.,MANAGEMENT,ehr_priv_sec,1,Riaz,,Operational,Vasily,,,,,,,
The EHRi must be capable of identifying of all users who have accessed or modified a given patient�s or person's record(s) over a given period of time. Rationale:  This requirement is intended to facilitate the discovery of inappropriate  access and assist in subsequent disciplinary or legal action.,ACCOUNTABILITY,ehr_priv_sec,1,Riaz,,Accountability,Vasily,,,,,,,
The EHRi must be capable of identifying all patients or persons whose records have been accessed or modified by a given user over a given period of time.,"ACCESS_CONTROL_IDENTITY,CONFIDENTIALITY",ehr_priv_sec,1,Riaz,,Accountability,Vasily,,,,,,,
The EHRi must provide functions for analyzing logs and audit trails to allow the identification of all users who have accessed or modified such record(s) over a given period of time.,ACCOUNTABILITY,ehr_priv_sec,1,Riaz,,Accountability,Vasily,,,,,,,
Rationale:  This requirement greatly facilitates the determination of suspicious or wrongful use of access privileges with regard to patients who are high profile or whose confidentiality is otherwise especially at risk.,"CONFIDENTIALITY,ACCOUNTABILITY",ehr_priv_sec,1,Riaz,,Accountability,Vasily,,,,,,,
"As noted in the discussion of Privacy Requirement 22a, the records of certain patients or persons (e.g. celebrities, politicians, and newsmakers) may be at elevated risk of access by those who do not have a need-to-know.",CONFIDENTIALITY,ehr_priv_sec,1,Riaz,,Confidentiality,Vasily,,,,,,,
"This requirement should not be construed as meaning that the information in the records of such patient or persons are somehow more confidential than those of ordinary citizens or that these records, as information assets, are more valuable than those that are not at elevated risk of inappropriate access.",CONFIDENTIALITY,ehr_priv_sec,1,Riaz,,Confidentiality,Vasily,,,,,,,
The EHRi must secure access to audit records and must safeguard access to system audit tools and audit trails to prevent misuse or compromise.,"INTEGRITY,CONFIDENTIALITY",ehr_priv_sec,1,Riaz,,Confidentiality,Vasily,,,,,,,
"Confidentiality is critical since a third party obtaining access to such a log might infer PHI from audit log entries (e.g., from a log entry indicating update of a patient record by a user at a cancer care centre, it could be inferred that the patient has cancer).",CONFIDENTIALITY,ehr_priv_sec,1,Riaz,,Confidentiality,Vasily,,,,,,,
The EHRi must provide appropriate security measures to protect audit logs from tampering.,CONFIDENTIALITY,ehr_priv_sec,1,Riaz,,Confidentiality,Vasily,,,,,,,
