Requirement,Context (Keywords),Name of Doc,Sec/NotSec,Labeled by,Comments,Label,Labeled by,Comments,,,,,,
On receipt of a valid (i.e. authorized) request for access to a CNG hosted service or application the CNG shall provide the requested service or application to the requesting user.,Security,SecReq,1,Айдар,,Integrity,Aydar,,,,,,,
On detection of any system failure or discontinuity not specifically handled by other mechanisms the CNG shall revert to a known safe state.,Security,SecReq,1,Айдар,,Availability,Aydar,,,,,,,
The CNG shall support mechanisms to authenticate itself to the NGN for connectivity purposes.,Security,SecReq,1,Айдар,,Confidentiality,Aydar,,,,,,,
The CNG shall support mechanisms to authenticate itself to the NGN for service usage purposes.,Security,SecReq,1,Айдар,,Integrity,Aydar,,,,,,,
The CNG shall support mechanisms to authenticate CNDs to the NGN for service usage purposes if they are not able to fully support the related procedures in an autonomous way.,Security,SecReq,1,Айдар,,Integrity,Aydar,,,,,,,
The CNG shall support mechanisms for authentication of wireless CNDs for local connectivity. Similar mechanisms may be also implemented for non-wireless devices.,Security,SecReq,1,Айдар,,Confidentiality,Aydar,,,,,,,
The CNG and CPN shall support mechanisms that prevent access to the network by unauthorized users.,Security,SecReq,1,Айдар,,Integrity,Aydar,,,,,,,
The capacity of the authorized entities should depend on the security policies defined by the service providers managing the CNG.,Security,SecReq,1,Айдар,,Operational,Aydar,Not sure,,,,,,
The CNG and the CPN shall implement mechanisms to limit the visibility of the WAN side network and resources to authorized entities.,Security,SecReq,1,Айдар,,Access control,Aydar,Not sure,,,,,,
The diagnostic operations on the CPN by an operator shall be performed in accordance with rules protecting the users' privacy.,Security,SecReq,1,Айдар,,Confidentiality,Aydar,,,,,,,
CPN environment shall be protected with a stateful firewall function that may be implemented in the CNG.,Security,SecReq,1,Айдар,,Availability,Aydar,Not sure,,,,,,
The CNG and the CPN shall be able to support parental control related functionalities limiting the use of the broadband connection on a user or time basis. Limitations on a content basis may be shared with devoted network servers.,Security,SecReq,1,Айдар,,Operational,Aydar,,,,,,,
All applications under the GlobalPlatform shall be implemented in a hardware-neutral secure runtime environment,Security,SecReq,1,Айдар,,Operational,Aydar,"Too broad, not sure",,,,,,
The run time environment shall be responsible to separate secure storage for the application code and data,Security,SecReq,1,Айдар,,Integrity,Aydar,,,,,,,
Security domain shall ensure complete seperation of keys among the card issuers and other application providers,Security,SecReq,1,Айдар,,Integrity,Aydar,,,,,,,
"""Security Domains shall support security services such as key handling, encryption, decryption, digital signature generation and verification for their providers' such as card issuer, applicaiton providers and controlling authority""",Security,SecReq,1,Айдар,,Integrity,Aydar,,,,,,,
The OPEN shall responsible to enforce security principles defined for Card Content management.,Security,SecReq,1,Айдар,,Other,Aydar,,,,,,,
The GlobalPlatform API shall provides services to the application such as card verification and security services,Security,SecReq,1,Айдар,,Confidentiality,Aydar,,,,,,,
The primary goal of the GlobalPlatform is to ensure the security and integrity of the card's components for the life of the card. These components are The runtime environment The OPEN The Issuer Security Domain Supplementary Security Domains The Applications.,Security,SecReq,1,Айдар,,Integrity,Aydar,,,,,,,
To ensure card security and integrity the GlobalPlatform is designed to support a range of secure mechanisms for: Data integrity Resource availability Confidentiality Authentication.,Security,SecReq,1,Айдар,,Availability/Confidentiality/Integrity,Aydar,,,,,,,
The Card Issuer is responsible for Generating and loading the Issuer Security Domain keys,Security,SecReq,1,Айдар,,Integrity,Aydar,,,,,,,
"""The Card Issuer is responsible for Enforcing standards and policies for Application Providers governing all aspects of Applications to be provided to the Card Issuer or operated on the Card Issuer's cards,""",Security,SecReq,1,Айдар,,Operational,Aydar,"Too broad, not sure",,,,,,
The Card Issuer is responsible for Cryptographically authorizing load install and extradition to be performed by Application Providers.,Security,SecReq,1,Айдар,,Operational,Aydar,,,,,,,
"""The Application Provider is responsible for Generating the keys for its own Security Domains or obtaining Security Domain keys from a trusted third party,""",Security,SecReq,1,Айдар,,Operational,Aydar,Not sure,,,,,,
The Application Provider is responsible for Working with the Card Issuer to load generated keys into the Application Provider's Security Domain,Security,SecReq,1,Айдар,,Operational,Aydar,Not sure,,,,,,
"""The Application Provider is responsible for Providing load file data block signatures according to its own security policy for integrity and source authenticity,""",Security,SecReq,1,Айдар,,Integrity,Aydar,,,,,,,
"""A Controlling Authority is responsible for Generating the keys for its own Security Domain or obtaining Security Domain keys from a trusted third party,""",Security,SecReq,1,Айдар,,Operational,Aydar,Not sure,,,,,,
A Controlling Authority is responsible for Working with the Card Issuer to load generated keys into the Controlling Authority's Security Domain,Security,SecReq,1,Айдар,,Operational,Aydar,Not sure,,,,,,
"""A Controlling Authority is responsible for Providing load file data block signatures according to its own security policy for integrity and source authenticity.""",Security,SecReq,1,Айдар,,Integrity,Aydar,,,,,,,
"""The runtime environment is responsible for Providing an interface to all Applications that ensures that the runtime environment security mechanisms cannot be bypassed, deactivated, corrupted or otherwise circumvented,""",Security,SecReq,1,Айдар,,Integrity,Aydar,Not sure,,,,,,
The runtime environment is responsible for Performing secure memory management,Security,SecReq,1,Айдар,,Integrity,Aydar,,,,,,,
"""Secure memory management shall ensure that Each application's code and data (including transient session data) as well as the runtime environment itself and its data (including transient session data) is protected from unauthorized access from within the card,""",Security,SecReq,1,Айдар,,Integrity,Aydar,,,,,,,
"""Secure memory management shall ensure that When more than one logical channel is supported, each concurrently selected Application's code and data (including transient session data) as well as the runtime environment itself and its data (including transient session data) is protected from unauthorized access from within the card,""",Security,SecReq,1,Айдар,,Integrity,Aydar,,,,,,,
Secure memory management shall ensure that The previous contents of the memory is not accessible when that memory is reused,Security,SecReq,1,Айдар,,Integrity,Aydar,,,,,,,
"""Secure memory management shall ensure that The memory recovery process is secure and consistent in case of a loss of power or withdrawal of the card from the card reader while an operation is in progress,""",Security,SecReq,1,Айдар,,Integrity,Aydar,,,,,,,
"""The runtime environment is responsible for Providing communication services with off-card entities that ensures the proper transmission (according to the specific communication protocol rules) of unaltered command and response messages.""",Security,SecReq,1,Айдар,,Integrity,Aydar,,,,,,,
Each Trusted Framework present on the card shall Check the application access rules of the inter-acting Applications according to their respective privileges,Security,SecReq,1,Айдар,,Integrity,Aydar,,,,,,,
"""Each Trusted Framework present on the card shall Enforce the Trusted Framework security rules for inter-application communication, including the rules, defined in appendix G,""",Security,SecReq,1,Айдар,,Integrity,Aydar,,,,,,,
Each Trusted Framework present on the card shall Ensure that incoming messages are properly routed unaltered to their intended destinations,Security,SecReq,1,Айдар,,Integrity,Aydar,,,,,,,
"""Each Trusted Framework present on the card shall Ensure that any response messages are properly returned unaltered (except for any cryptographic protection) to the original receiver of the incoming message.""",Security,SecReq,1,Айдар,,Integrity,Aydar,,,,,,,
"""The OPEN shall Provide an interface to all Applications that ensures that the GlobalPlatform security mechanism cannot be bypassed, deactivated, corrupted or otherwise circumvented,""",Security,SecReq,1,Айдар,,Integrity,Aydar,Not sure,,,,,,
The OPEN shall Check application access rules according to the Applications' privileges,Security,SecReq,1,Айдар,,Confidentiality,Aydar,,,,,,,
The OPEN shall Ensure that the Card Content changes are authorized by the Card Issuer,Security,SecReq,1,Айдар,,Integrity,Aydar,,,,,,,
The OPEN shall Ensure that application code has been signed by the Controlling Authority represented on the card,Security,SecReq,1,Айдар,,Integrity,Aydar,,,,,,,
The OPEN shall Ensure that application code has been signed by Application Providers represented on the card if required.,Security,SecReq,1,Айдар,,Integrity,Aydar,Not sure,,,,,,
Security Domains enforce the security policies of their off-card Security Domain Provider.,Security,SecReq,1,Айдар,,Operational,Aydar,,,,,,,
"""When applicable a Security Domain shall Communicate with off-card entities in accordance with its Security Domain Provider's security policy in Pre-Issuance and Post-Issuance,""",Security,SecReq,1,Айдар,,Operational,Aydar,,,,,,,
When applicable a Security Domain shall Manage on-card data securely,Security,SecReq,1,Айдар,,Integrity,Aydar,,,,,,,
"""When applicable a Security Domain shall Provide cryptographic protection services for its own Applications during their personalization and optionally during their subsequent operation,""",Security,SecReq,1,Айдар,,Integrity,Aydar,,,,,,,
When applicable a Security Domain shall Verify the authorization for Card Content changes initiated by an off-card authority,Security,SecReq,1,Айдар,,Integrity,Aydar,,,,,,,
When applicable a Security Domain shall Verify the load file data block signature when requested by the OPEN.,Security,SecReq,1,Айдар,,Integrity,Aydar,,,,,,,
A Global Services Application shall Hold the Global Services application-related data securely,Security,SecReq,1,Айдар,,Integrity,Aydar,,,,,,,
A Global Services Application shall Perform internal security measures as required by the service.,Security,SecReq,1,Айдар,,Integrity,Aydar,,,,,,,
Applications should Expose only data and resources that are necessary for proper application functionality,Security,SecReq,1,Айдар,,Integrity,Aydar,,,,,,,
Applications should Perform internal security measures required by the Application Provider,Security,SecReq,1,Айдар,,Accountability,Aydar,Not sure,,,,,,
The back-end systems (multiple back-end systems may exist for a single card) which communicate with the cards perform the verifications and manage the off-card key databases also shall be trusted.,Security,SecReq,1,Айдар,,Integrity,Aydar,,,,,,,
"""One of the major requirements for a GlobalPlatform card is the ability to provide a minimum level of cryptographic functionality. This cryptography is, for example, used for the generation of signatures, and is available for use by the Applications present on the card.""",Security,SecReq,1,Айдар,,Other,Aydar,Not sure,,,,,,
The Issuer Security Domain shall implement one Secure Channel Protocol.,Security,SecReq,1,Айдар,,Operational,Aydar,,,,,,,
A Security Domain other than the Issuer Security Domain shall implement [at least] one Secure Channel Protocol.,Security,SecReq,1,Айдар,,Operational,Aydar,,,,,,,
A GlobalPlatform card should support symmetric cryptography such as the Data Encryption Standard (DES) algorithm.,Security,SecReq,1,Айдар,,Integrity,Aydar,,,,,,,
A GlobalPlatform card may also support asymmetric cryptography such as the Rivest / Shamir / Adleman (RSA) algorithm.,Security,SecReq,1,Айдар,,Integrity,Aydar,,,,,,,
When present services to encrypt and decrypt any pattern of data using these algorithms shall be available to Applications.,Security,SecReq,1,Айдар,,Integrity,Aydar,,,,,,,
"""It is the responsibility of the Card Issuer or the Controlling Authority to set up the appropriate off-card procedures to comply with the governmental restrictions upon cryptography. Features to disable or restrict cryptography usage by Applications on a card are beyond the scope of this Specification"".",Security,SecReq,1,Айдар,,Integrity,Aydar,,,,,,,
The Load File Data Block Hash is intended to verify the integrity of a complete Load File Data Block when loaded to a GlobalPlatform card.,Security,SecReq,1,Айдар,,Integrity,Aydar,,,,,,,
The Load File Data Block Hash is used in the computation of The Load File Data Block Signature.,Security,SecReq,1,Айдар,,Other,Aydar,,,,,,,
When present during the loading of a Load File to the card each signature shall be verified by the appropriate Security Domain.,Security,SecReq,1,Айдар,,Confidentiality,Aydar,,,,,,,
Tokens shall be verified by the appropriate Security Domain.,Security,SecReq,1,Айдар,,Confidentiality,Aydar,,,,,,,
A GlobalPlatform card offers Entity authentication - in which the card or the off-card entity proves its authenticity to the other entity through a cryptographic exchange.,Security,SecReq,1,Айдар,,Confidentiality,Aydar,,,,,,,
A GlobalPlatform card offers Integrity and authentication - in which the receiving entity (the card or off-card entity) ensures that the data being received from the sending entity (respectively the off-card entity or card) actually came from an authenticated entity in the correct sequence and has not been altered,Security,SecReq,1,Айдар,,Integrity,Aydar,,,,,,,
A GlobalPlatform card offers Confidentiality - in which data being transmitted from the sending entity (the off-card entity or card) to the receiving entity (respectively the card or off-card entity) is not viewable by an unauthenticated entity.,Security,SecReq,1,Айдар,,Confidentiality,Aydar,,,,,,,
The life cycle models is responsible to functionality and security of Card Executable Load Files Executable Modules Security Domains and Applications.,Security,SecReq,1,Айдар,,Other,Aydar,Not sure,,,,,,
The OPEN shall be responsible to maintain security and administration of the card and its content.,Security,SecReq,1,Айдар,,Integrity,Aydar,,,,,,,
The off-card entity under the OP_READY state may insert Security Domain keys in order to maintain a cryptographic key separation from the Issuer Security Domain keys.,Security,SecReq,1,Айдар,,Operational,Aydar,Not sure,,,,,,
The SECURED state may be used to enforce the relevant security policies of the security domain and applications.,Security,SecReq,1,Айдар,,Other,Aydar,Not sure,,,,,,
The off-card entity under the SECURE state shall be used to ensure the availability of all keys by the issuer security domain.,Security,SecReq,1,Айдар,,Availability,Aydar,,,,,,,
Successful authentication is a prerequisite for the processing of any on-line or offline CEPS transaction.,Security,SecReq,1,Айдар,,Integrity,Aydar,,,,,,,
On-line authentication must take place between the card issuer and the CEP card for load unload and currency exchange transactions.,Security,SecReq,1,Айдар,,Confidentiality,Aydar,,,,,,,
The card issuer and the CEP card share a secret key to generate and verify MACs.,Security,SecReq,1,Айдар,,Confidentiality,Aydar,,,,,,,
Off-line authentication must take place between a PSAM in the POS device and the CEP card for purchase and cancel last purchase transactions.,Security,SecReq,1,Айдар,,Confidentiality,Aydar,,,,,,,
The card and the PSAM must use a public key algorithm for mutual authentication and session key exchange as no permanent shared secret key may exist between the CEP card and the PSAM.,Security,SecReq,1,Айдар,,Integrity,Aydar,,,,,,,
To load value into a slot of the CEP card securely the load device establishes a connection between the issuer and the CEP card.,Security,SecReq,1,Айдар,,Integrity,Aydar,,,,,,,
The card should use a unique diversified secret key personalized into the card to generate and authenticate transaction signatures,Security,SecReq,1,Айдар,,Confidentiality,Aydar,,,,,,,
If this is not a cash load the funds issuer needs to verify that the funds are requested by the legitimate account owner which is normally done by the presentation of an enciphered PIN.,Security,SecReq,1,Айдар,,Integrity,Aydar,,,,,,,
The card issuer needs to ensure that the load acquirer is guaranteeing payment for the electronic value and that the card is authentic.,Security,SecReq,1,Айдар,,Integrity,Aydar,,,,,,,
The load acquirer needs to ensure that the issuer is the true owner of the card and in the case of an apparent failure of the load the load acquirer needs the card presented to authenticate the failure.,Security,SecReq,1,Айдар,,Integrity,Aydar,,,,,,,
The load device sends S1 in an authorization request to the issuer.,Security,SecReq,1,Айдар,,Confidentiality,Aydar,,,,,,,
The load device also provides for verification of the identity of the cardholder (with either on-line or off-line PIN verification) and forwards verification data in the authorization request.,Security,SecReq,1,Айдар,,Confidentiality,Aydar,,,,,,,
The issuer validates S1 to authenticate the card and the data to be used in the transaction.,Security,SecReq,1,Айдар,,Confidentiality,Aydar,,,,,,,
The issuer sends S2 to the load acquirer in the authorization response message.,Security,SecReq,1,Айдар,,Integrity,Aydar,,,,,,,
Unloads are permitted only to an account controlled by the card issuer and are performed only at a load device under the control of the card issuer.,Security,SecReq,1,Айдар,,Integrity,Aydar,,,,,,,
The cardholder must have an account relationship with the card issuer and funds removed from the card are credited to the cardholder account only after the card issuer authenticates the card.,Security,SecReq,1,Айдар,,Confidentiality,Aydar,,,,,,,
The issuer needs only to authenticate the card and the card needs only to authenticate the issuer and that the data is the same as used by the issuer.,Security,SecReq,1,Айдар,,Confidentiality,Aydar,,,,,,,
The card generates S1 using data from the card and load device and sends S1 to the card issuer to authenticate the card and the data that is to be used in the transaction,Security,SecReq,1,Айдар,,Confidentiality,Aydar,,,,,,,
The card issuer generates S2 which is sent to the card to allow the card to validate the card issuer??s authenticity and to ensure that the data used by the card in the transaction is the same as the card issuer intended,Security,SecReq,1,Айдар,,Integrity,Aydar,,,,,,,
During a purchase transaction the CEP card must ensure that it is dealing with an authentic POS device and it must generate a signature to allow the card issuer to verify the integrity of the transaction,Security,SecReq,1,Айдар,,Integrity,Aydar,,,,,,,
The POS device must ensure that it is dealing with an authentic card and guarantee integrity of transactions and batches to the merchant acquirer,Security,SecReq,1,Айдар,,Integrity,Aydar,,,,,,,
In the case of a reversal the CEP card must re-authenticate the PSAM,Security,SecReq,1,Айдар,,Confidentiality,Aydar,,,,,,,
The card must ensure that the transaction is performed by the same POS device as was used for the purchase being canceled and that the amount of the cancellation is the same as the amount of the purchase or in the case of an incremental purchase the same as the amount of the last step,Security,SecReq,1,Айдар,,Integrity,Aydar,,,,,,,
During a Cancel Last Purchase transaction the CEP card is authenticated by the PSAM in the POS device,Security,SecReq,1,Айдар,,Confidentiality,Aydar,,,,,,,
The PSAM authenticates that the purchase transaction being canceled was performed by the PSAM and that the transaction being canceled is part of the active batch,Security,SecReq,1,Айдар,,Confidentiality,Aydar,,,,,,,
The card issuer and the merchant acquirer also authenticate the transaction when they receive it,Security,SecReq,1,Айдар,,Confidentiality,Aydar,,,,,,,
Transmissions between host systems should be protected by MACs based on unique keys that are shared by the nodes involved,Security,SecReq,1,Айдар,,Integrity,Aydar,,,,,,,
The transaction signatures ensure end to end integrity of transmitted data for load unload and currency exchange transactions,Security,SecReq,1,Айдар,,Integrity,Aydar,,,,,,,
These totals are used by the merchant acquirer to ensure the integrity of the batch,Security,SecReq,1,Айдар,,Integrity,Aydar,,,,,,,
The count and amount of the transactions in the batch must be protected by the S4 MAC This information is not part of the card issuer??s verification process,Security,SecReq,1,Айдар,,Integrity,Aydar,,,,,,,
Scheme providers must assign unique identifying numbers to merchant acquirers who provide PSAMs,Security,SecReq,1,Айдар,,Confidentiality,Aydar,,,,,,,
These merchant acquirers must then assign unique identifiers to PSAMs,Security,SecReq,1,Айдар,,Confidentiality,Aydar,,,,,,,
Each PSAM must maintain a transaction count The unique PSAM ID and the transaction count are used during a conversation with a CEP card. The transaction count must not be reset during the life of the PSAM,Security,SecReq,1,Айдар,,Integrity,Aydar,,,,,,,
Contain the CA public RSA key the PSAM??s private RSA key and optionally the certificates that the POS device uses to perform mutual authentication with the CEP card,Security,SecReq,1,Айдар,,Confidentiality,Aydar,,,,,,,
Perform the calculation required to generate a signature using the PSAM??s private RSA key to allow the CEP card to validate the PSAM,Security,SecReq,1,Айдар,,Integrity,Aydar,,,,,,,
Be the entity that maintains control over the flow of a transaction ensuring that all security is enforced,Security,SecReq,1,Айдар,,Integrity,Aydar,Not sure,,,,,,
Perform the verification of signatures and certificates during a purchase and cancel last purchase transaction,Security,SecReq,1,Айдар,,Accountability,Aydar,Not sure,,,,,,
Ensure that CA public keys aggregation parameters blocking lists and issuer certificate revocation lists from the scheme providers are sent to the POS devices,Security,SecReq,1,Айдар,,Accountability,Aydar,Not sure,,,,,,
Share one or more MAC keys with connecting processors create a MAC on each transmission sent to another processor and verify the MAC on each transmission received from another processor,Security,SecReq,1,Айдар,,Integrity,Aydar,Not sure,,,,,,
The scheme provider must ensure that the entire process between merchants merchant acquirers card issuers and processors is auditable and reconcilable,Security,SecReq,1,Айдар,,Integrity,Aydar,,,,,,,
If errors in the card issuer MAC are discovered by the card issuer during its processing of the transactions a dispute mechanism established by the scheme provider may be used to have money refunded,Security,SecReq,1,Айдар,,Integrity,Aydar,,,,,,,
If a scheme provider establishes a central error repository all transactions for the scheme with MAC errors must be sent to that central error repository whether or not they are submitted to the dispute process,Security,SecReq,1,Айдар,,Integrity,Aydar,,,,,,,
A purchase transaction may be reversed prior to the removal of the CEP card from the POS device by sending a purchase reversal command to the CEP card The CEP card must authenticate the PSAM using certificates previously exchanged,Security,SecReq,1,Айдар,,Integrity,Aydar,,,,,,,
The amount to be reversed is the amount of the last step of the transaction. The reversal command sent to the CEP card contains a S2 MAC computed by the PSAM.,Security,SecReq,1,Айдар,,Other,Aydar,Not sure,,,,,,
The PSAM in the POS device generates a merchant acquirer S5 MAC for the transaction computes a new S4 MAC on the updated batch total count and amount and logs the transaction,Security,SecReq,1,Айдар,,Accountability,Aydar,Not sure,,,,,,
The CEP card authenticates the PSAM using the certificates previously received and the S2 The CEP card increments the value of the purse and logs the transaction,Security,SecReq,1,Айдар,,Other,Aydar,Not sure,,,,,,
The CEP card verifies that the PSAM is the PSAM used in the original transaction computes a S1 MAC using the same DES session key that was used for the purchase transaction being cancelled and responds to the POS device with the S1 and the identification of the last transaction. If the purchase transaction to be canceled has been canceled or is not part of the active batch the command is not allowed,Security,SecReq,1,Айдар,,Integrity,Aydar,Not sure,,,,,,
The PSAM either retrieves or re-derives the DES session key used for the purchase transaction being cancelled. The POS device authenticates the CEP card using this key and the S1 MAC,Security,SecReq,1,Айдар,,Confidentiality,Aydar,,,,,,,
