Requirement,Context (Keywords),Name of Doc,Sec/NotSec,Labeled by,Comments,Label,Labeled by,Comments,,,,,,
The System must allow the user to limit access to cases to specified users or user groups.,Access Module,cctns.pdf,1,Кирилл,,Access control,Aydar,Not sure,All existing keywords:,Number of entries:,All existing labels:,Number of entries:,Accepted labels:,
The system should provide for role-based control for the functionality within the system.,Access Module,cctns.pdf,1,Кирилл,,Access control,Aydar,,Access Module,11,Access control,79,Confidentiality,358
The System must allow a user to be a member of more than one group.,Access Module,cctns.pdf,1,Кирилл,,Access control,Aydar,,Usability,1,Other,51,Integrity,254
The System must allow only admin-users to set up user profiles and allocate users to groups.,Access Module,cctns.pdf,1,Кирилл,,Access control,Aydar,,Security Requirements,51,Confidentiality,358,Availability,45
The System should allow a user to stipulate which other users or groups can access cases.,Access Module,cctns.pdf,1,Кирилл,,Access control,Aydar,,Functional requirements,55,Accountability,140,Accountability,140
"The System must allow changes to security attributes for groups or users (such as access rights, security level, privileges, password allocation and management) to be made only by super-user.",Access Module,cctns.pdf,1,Кирилл,,Access control,Aydar,,Non-functional requirements,4,Integrity,254,Operational,132
"If a user requests access to, or searches for, a case which he does not have the right to access, the System must provide one of the following responses (selectable at configuration time): display title and metadata; display the existence of a case but not its title or other metadata; do not display any case information or indicate its existence in any way, these options are presented in order of increasing security, note that the requirement in the third option (i.e. the most stringent) implies that the System must not include such cases in any count of search results; this level of security is normally appropriate for cases dealing with matters such as national security.",Access Module,cctns.pdf,1,Кирилл,,Access control,Aydar,,Memory Management Services,1,Availability,45,Access control,79
These options are presented in order of increasing security. Note that the requirement in the third option (i.e. the most stringent) implies that the System must not include such cases in any count of search results; this level of security is normally appropriate for cases dealing with matters such as national security.,Access Module,cctns.pdf,1,Кирилл,,Other,Aydar,,Security,422,Confidentiality/Integrity/Access control,1,Other,51
"If a user performs a quick or advanced search, the System must never include in the search result list any record which the user does not have the right to access.",Access Module,cctns.pdf,1,Кирилл,,Confidentiality,Aydar,,Presence,1,Operational,132,Sum:,1059
"If the System allows users to make unauthorised attempts to access cases, it must log these in the audit trail.",Access Module,cctns.pdf,1,Кирилл,,Accountability,Aydar,,Systems: Security,3,continue,2,All:,1094
"Any access to cases, and all other activities involving the cases and related documents or data should also need to be stored in the audit trail to ensure legal admissibility and to assist in data recovery.",Access Module,cctns.pdf,1,Кирилл,,Accountability,Aydar,,Specific High Level Requirements,4,Availability/Confidentiality/Integrity,1,Left no good:,35
Appropriate content presentation also plays a key role in accessibility.,Usability,cctns.pdf,1,Кирилл,,Other,Aydar,,Access,23,Functional,5,,
The system shall validate credit cards against fraud.,Security Requirements,gamma j.pdf,1,Кирилл,,Confidentiality,Aydar,,Software System Attributes,1,Confidentiality?,4,,
The system shall encrypt all sensitive information via https.,Security Requirements,gamma j.pdf,1,Кирилл,,Integrity,Aydar,,Overall Description,1,Integrity?,2,,
The system shall encrypt all customer data in database.,Security Requirements,gamma j.pdf,1,Кирилл,,Integrity,Aydar,,System Features,11,Operational?,7,,
The system shall auto detect IP DOS attacks and block IP automatically.,Security Requirements,gamma j.pdf,1,Кирилл,,Integrity,Aydar,,Functional Requirements,55,Availability?,2,,
The system shall detect consecutive failed login attempts.,Security Requirements,gamma j.pdf,1,Кирилл,,Confidentiality,Aydar,,Design Constraints,3,Access control?,1,,
The system shall be protected by open source firewall called Firestarter. http://www.fs-security.com/,Security Requirements,gamma j.pdf,1,Кирилл,,Other,Aydar,,Non-Functional Requirements,4,I don't know,7,,
Any administrative level user can delegate another user to execute some or all his authorized actions.,Functional requirements,inventory.pdf,1,Кирилл,,Confidentiality,Aydar,,Safety Requirements,1,Operational/Accountability,3,,
"As the data being exchanged between machines does not contain any private information and is not capable of undermining the system integrity of the computers connected to the MultiMahjongServer, encryption and protection of data are not needed.",Non-functional requirements,multi-mahjong.pdf,1,Кирилл,,Integrity,Aydar,,User characteristics,1,,0,,
Sockets maintain the buffers between the underlying packet based communication primitives that directly access the network elements and the message based.,Memory Management Services,nasa x38.doc,1,Кирилл,,Availability,Aydar,Not sure,Access Privileges,6,,0,,
Remote monitoring and operation of devices requires strict security measures for several rea- sons.,Security,elsfork.pdf,1,Кирилл,,Other,Aydar,Not sure,Quality Attributes,1,,0,,
"To protect the data from being stolen, corrupted, and intentionally falsified, to protect the device from unauthorised use or to preserve the privacy of monitoring data.",Security,elsfork.pdf,1,Кирилл,,Integrity,Aydar,,Basic Functional Requirements,22,,,,
"To enforce these security requirements the following functionality is needed: Authentication, Data Integrity and Data Confidentiality.",Security,elsfork.pdf,1,Кирилл,,Confidentiality/Integrity/Access control,Aydar,,Required States and Modes,3,,,,
Server authentication shall ensure the client application that it is truly operating on the in- tended site.,Security,elsfork.pdf,1,Кирилл,,Confidentiality,Aydar,,Capability Requirements,4,,,,
Client authentication ensures that an authorised client/operator is operating the equipment.,Security,elsfork.pdf,1,Кирилл,,Integrity,Aydar,,Security and Privacy Requirements,2,,,,
The rights for each user to operate functions and to see data on different levels in the object hierarchy might be necessary to set.,Security,elsfork.pdf,1,Кирилл,,Integrity,Aydar,,System Support,1,,,,
In that way all users can have relevant access to the sys- tem and get updated information from the wind power plants.,Security,elsfork.pdf,1,Кирилл,,Availability,Aydar,,Administrative Services,9,,,,
"Non-corruption of data transferred is necessary, i.e. the ability of a communication system to deliver data from its originator to its destination with an acceptable residual error rate.",Security,elsfork.pdf,1,Кирилл,,Integrity,Aydar,,Presentation Services,3,,,,
This prevents both malicious and false operation.,Security,elsfork.pdf,1,Кирилл,,Integrity,Aydar,,External Requirements,1,,,,
"Data items transferred might need to be encrypted to prevent both malicious and false opera- tion, as well as eavesdropping.",Security,elsfork.pdf,1,Кирилл,,Integrity,Aydar,,Specific Requirements,3,,,,
The APAF system web server shall be password protected where appropriate to allow only pertinent ASPERA-3 team members access.,Security,esa.pdf,1,Кирилл,,Confidentiality,Aydar,,Nonfunctional Requirements,6,,,,
The user shall not be required to log in or authenticate his/her identity when using the system.,Security,hats.pdf,1,Кирилл,,Confidentiality,Aydar,,Functionality,5,,,,
"The NPAC will accept only authorized NPAC customers through interface connections, and among NPAC customers, the NPAC will make appropriate limitations on their actions (for example, letting only old or new Service Providers view a pending record). The NPAC will only accept authorized customer user IDs. However, the NPAC will make no distinction among an NPAC customer’s employees; the NPAC customer and their systems must control individual NPAC customer employee actions.",Security,npac.doc,1,Кирилл,,Integrity,Aydar,,Interfaces,2,,,,
"A user identification is a unique, auditable representation of the user's identity within the system. The NPAC SMS requires all system users, both individuals and remote machines, to be uniquely identified to support individual accountability over the NPAC Administrative and NPAC SOA Low-tech Interfaces.",Security,npac.doc,1,Кирилл,,Accountability,Aydar,,Configuration & Administration Service (CAS),4,,,,
NPAC SMS shall require unique user identification codes (userids) to identify all NPAC and Service Provider personnel.,Security,npac.doc,1,Кирилл,,Confidentiality,Aydar,,Configuration & Administration User Interface (CAUI),2,,,,
NPAC SMS shall require NPAC and Service Provider personnel to identify themselves with their assigned userId before performing any actions.,Security,npac.doc,1,Кирилл,,Confidentiality,Aydar,,ACCESS_CONTROL_IDENTITY,45,,,,
NPAC SMS shall maintain internally the identity of all NPAC and Service Provider personnel logged on to the NPAC SMS.,Security,npac.doc,1,Кирилл,,Confidentiality,Aydar,,ACCOUNTABILITY,74,,,,
NPAC SMS shall have for every process running an associated userId of the invoking user (or the userId associated with the invoking process).,Security,npac.doc,1,Кирилл,,Confidentiality,Aydar,,PRIVACY,26,,,,
NPAC SMS shall disable userids after a period of time during which the userId has not been used.,Security,npac.doc,1,Кирилл,,Access control,Aydar,,"ACCESS_CONTROL_IDENTITY,INTEGRITY",2,,,,
NPAC SMS shall provide an Unused Userid Disable Period tunable parameter which is defined as the number of days for which the userId has not been used.,Security,npac.doc,1,Кирилл,,Access control,Aydar,,INTEGRITY,46,,,,
NPAC SMS shall allow the NPAC SMS administrator to modify the Unused Userid Disable Period tunable parameter time period.,Security,npac.doc,1,Кирилл,,Confidentiality,Aydar,,CONFIDENTIALITY,52,,,,
NPAC SMS shall default the Unused Userid Disable Period tunable parameter to 60 days.,Security,npac.doc,1,Кирилл,,Confidentiality,Aydar,,"ACCESS_CONTROL_IDENTITY,CONFIDENTIALITY",3,,,,
NPAC SMS shall provide a complementary mechanism or procedure for the re‑instatement disabled userids.,Security,npac.doc,1,Кирилл,,Availability,Aydar,Not sure,"CONFIDENTIALITY,PRIVACY",2,,,,
NPAC SMS shall provide a procedure for the deletion of userids.,Security,npac.doc,1,Кирилл,,Other,Aydar,Not sure,AVAILABILITY,12,,,,
NPAC SMS shall support the temporary disabling of userids.,Security,npac.doc,1,Кирилл,,Other,Aydar,Not sure,INTEGRITY_IMMUNITY,2,,,,
NPAC SMS shall provide an option for automatic reactivation of disabled userids.,Security,npac.doc,1,Кирилл,,Other,Aydar,Not sure,"CONFIDENTIALITY,ACCOUNTABILITY",6,,,,
NPAC SMS shall control and limit simultaneous active usage of the same userids by allowing only one active login.,Security,npac.doc,1,Кирилл,,Confidentiality,Aydar,,"AVAILABILITY,INTEGRITY",2,,,,
"NPAC SMS shall present the NPAC or Service Provider personnel with an option of disconnecting the first login and continuing the second login or terminating the second login, when a second login is entered.",Security,npac.doc,1,Кирилл,,Access control,Aydar,,MANAGEMENT,57,,,,
"The identity of all NPAC SMS system users, both individuals and remote machines, must be verified or authenticated to enter the system, and to access restricted data or transactions over the NPAC Administrative and NPAC SOA Low-Tech Interfaces.",Security,npac.doc,1,Кирилл,,Integrity,Aydar,,OPERATIONAL,58,,,,
NPAC SMS shall authenticate the identity of all NPAC and Service Provider users of the NPAC Administrative and NPAC SOA Low-tech Interfaces prior to their initially gaining access to NPAC SMS.,Security,npac.doc,1,Кирилл,,Confidentiality,Aydar,,"MANAGEMENT,PRIVACY",1,,,,
NPAC SMS shall protect all internal storage of authentication data so that it can only be accessed by an NPAC Security Administrator user.,Security,npac.doc,1,Кирилл,,Integrity,Aydar,,"CONFIDENTIALITY,INTEGRITY",2,,,,
NPAC SMS shall require a single password entry for each userId.,Security,npac.doc,1,Кирилл,,Confidentiality,Aydar,,"PRIVACY,ACCOUNTABILITY",1,,,,
NPAC SMS shall allow a user to define a password that is already associated with another userId.,Security,npac.doc,1,Кирилл,,Confidentiality,Aydar,,"PRIVACY,CONFIDENTIALITY",2,,,,
NPAC SMS shall store passwords in a one‑way encrypted form.,Security,npac.doc,1,Кирилл,,Integrity,Aydar,,"CONFIDENTIALITY,OPERATIONAL",1,,,,
NPAC SMS shall only allow access to encrypted passwords by authorized users.,Security,npac.doc,1,Кирилл,,Confidentiality,Aydar,,"PRIVACY,ACCOUNTABILITY,CONFIDENTIALITY",1,,,,
NPAC SMS shall automatically suppress or fully blot out the clear‑text representation of the password on the data entry device.,Security,npac.doc,1,Кирилл,,Confidentiality,Aydar,,"OPERATIONAL,MANAGEMENT",1,,,,
NPAC SMS shall ensure that passwords sent over public or external shared data networks are encrypted.,Security,npac.doc,1,Кирилл,,Confidentiality,Aydar,,"MANAGEMENT,CONFIDENTIALITY",1,,,,
NPAC SMS shall require non-null passwords.,Security,npac.doc,1,Кирилл,,Access control,Aydar,,"CONFIDENTIALITY,INTEGRITY,AVAILABILITY",2,,,,
NPAC SMS shall provide a mechanism to allow passwords to be user‑changeable. This mechanism shall require re‑authentication of the user identity.,Security,npac.doc,1,Кирилл,,Confidentiality,Aydar,,"OPERATIONAL,INTEGRITY,AVAILABILITY",1,,,,
The NPAC SMS shall have a mechanism to reset passwords.,Security,npac.doc,1,Кирилл,,Confidentiality,Aydar,,"OPERATIONAL,CONFIDENTIALITY",1,,,,
NPAC SMS shall enforce password aging.,Security,npac.doc,1,Кирилл,,Confidentiality,Aydar,,"AVAILABILITY_SURVIVABILITY,OPERATIONAL",1,,,,
NPAC SMS shall default the system password aging to 90 days.,Security,npac.doc,1,Кирилл,,Confidentiality,Aydar,,"CONFIDENTIALITY,INTEGRITY,OPERATIONAL,MANAGEMENT",1,,,,
NPAC SMS shall notify users a NPAC‑specifiable period of time prior to their password expiring. The system supplied default shall be seven days.,Security,npac.doc,1,Кирилл,,Confidentiality,Aydar,,"OPERATIONAL,INTEGRITY_IMMUNITY",1,,,,
NPAC SMS shall default the password expiration notification time period to seven days,Security,npac.doc,1,Кирилл,,Confidentiality,Aydar,,"AVAILABILITY,OPERATIONAL",1,,,,
NPAC SMS shall require any user whose password has expired to enter a new password before allowing that user access to the system.,Security,npac.doc,1,Кирилл,,Confidentiality,Aydar,,"OPERATIONAL,PRIVACY",1,,,,
NPAC SMS shall ensure that a password can not be reused by the same individual for specifiable period of time.,Security,npac.doc,1,Кирилл,,Confidentiality,Aydar,,"OPERATIONAL,CONFIDENTIALITY,PRIVACY",1,,,,
NPAC SMS shall default the time period in which a password can not be reused to six months.,Security,npac.doc,1,Кирилл,,Confidentiality,Aydar,,"AVAILABILITY,ACCOUNTABILITY",4,,,,
Passwords shall contain a combination of at least six case-sensitive alphanumeric characters including at least one alphabetic and one numeric or punctuation character.,Security,npac.doc,1,Кирилл,,Confidentiality,Aydar,,"AVAILABILITY,OPERATIONAL,ACCOUNTABILITY",1,,,,
NPAC SMS shall ensure that passwords do not contain the associated userId.,Security,npac.doc,1,Кирилл,,Confidentiality,Aydar,,"INTEGRITY,CONFIDENTIALITY",3,,,,
NPAC SMS shall provide a password generator.,Security,npac.doc,1,Кирилл,,Confidentiality,Aydar,,"INTEGRITY,CONFIDENTIALITY,ACCOUNTABILITY",1,,,,
"NPAC SMS shall ensure that generated passwords are ""reasonably"" resistant to brute‑force password guessing attacks.",Security,npac.doc,1,Кирилл,,Confidentiality,Aydar,,"CONFIDENTIALITY,ACCESS_CONTROL_IDENTITY",1,,,,
NPAC SMS shall ensure that the generated sequence of passwords have the property of randomness.,Security,npac.doc,1,Кирилл,,Confidentiality,Aydar,,AVAILABILITY_SURVIVABILITY,1,,,,
NPAC SMS shall allow access to authorized individual users.,Security,npac.doc,1,Кирилл,,Confidentiality,Aydar,,"AVAILABILITY_SURVIVABILITY,CONFIDENTIALITY,INTEGRITY",2,,,,
NPAC SMS shall allow access to authorized remote systems.,Security,npac.doc,1,Кирилл,,Integrity,Aydar,,"OPERATIONAL,AVAILABILITY",1,,,,
NPAC SMS shall provide a facility for the initial entry of authorized user and associated authentication information.,Security,npac.doc,1,Кирилл,,Confidentiality,Aydar,,"ACCOUNTABILITY,CONFIDENTIALITY",2,,,,
NPAC SMS shall provide a facility for the modification of authorized user and associated authentication information.,Security,npac.doc,1,Кирилл,,Integrity,Aydar,,"ACCESS_CONTROL_IDENTITY,ACCOUNTABILITY",1,,,,
"NPAC SMS's login procedure shall be able to be reliably initiated by the user, i.e., a trusted communications path should exist between NPAC SMS and the user during the login procedure.",Security,npac.doc,1,Кирилл,,Confidentiality,Aydar,,"OPERATIONAL,INTEGRITY",1,,,,
NPAC SMS shall disconnect end users after a period of non‑use.,Security,npac.doc,1,Кирилл,,Confidentiality,Aydar,,TECHNICAL,1,,,,
NPAC SMS shall default the Non-use Disconnect tunable parameter to 60 minutes.,Security,npac.doc,1,Кирилл,,Confidentiality,Aydar,,,0,,,,
NPAC SMS shall exit and end the session if the user authentication procedure is incorrectly performed a specifiable number of times.,Security,npac.doc,1,Кирилл,,Confidentiality,Aydar,,,,,,,
NPAC SMS shall default the number of allowable incorrect login attempts to 3.,Security,npac.doc,1,Кирилл,,Confidentiality,Aydar,,,,,,,
NPAC SMS shall provide a mechanism to immediately notify the NPAC SMS system administrator when the threshold in R7-33.1 is exceeded.,Security,npac.doc,1,Кирилл,,Confidentiality,Aydar,,,,,,,
NPAC SMS shall restart the login process when the threshold in R7-33.1 has been exceeded and a specified interval of time has passed.,Security,npac.doc,1,Кирилл,,Confidentiality,Aydar,,,,,,,
NPAC SMS shall default the time interval to restart the login process to 60 seconds.,Security,npac.doc,1,Кирилл,,Confidentiality,Aydar,,,,,,,
NPAC SMS shall not suspend the userId upon exceeding the threshold in R7-33.1.,Security,npac.doc,1,Кирилл,,Confidentiality,Aydar,,,,,,,
NPAC SMS shall perform the entire user authentication procedure even if the userId that was entered was not valid.,Security,npac.doc,1,Кирилл,,Confidentiality,Aydar,,,,,,,
"NPAC SMS shall only provide error feedback of ""invalid"".",Security,npac.doc,1,Кирилл,,Confidentiality,Aydar,,,,,,,
"NPAC SMS shall provide a mechanism to restrict user login based on time-of-day, day‑of‑week, and calendar date.",Security,npac.doc,1,Кирилл,,Confidentiality,Aydar,,,,,,,
NPAC SMS shall provide a mechanism to restrict user login based on method of entry.,Security,npac.doc,1,Кирилл,,Confidentiality,Aydar,,,,,,,
NPAC SMS shall provide a mechanism to restrict user login based on user system location.,Security,npac.doc,1,Кирилл,,Confidentiality,Aydar,,,,,,,
NPAC SMS shall provide a mechanism to limit the users authorized to access the system via dial‑up facilities.,Security,npac.doc,1,Кирилл,,Confidentiality,Aydar,,,,,,,
NPAC SMS shall provide a mechanism to limit system entry for privileged NPAC SMS users on a specifiable network access.,Security,npac.doc,1,Кирилл,,Confidentiality,Aydar,,,,,,,
NPAC SMS shall provide a mechanism to limit system entry for privileged NPAC SMS users on a specifiable per‑port basis.,Security,npac.doc,1,Кирилл,,Confidentiality,Aydar,,,,,,,
NPAC SMS shall provide a strong authentication mechanism for network access.,Security,npac.doc,1,Кирилл,,Confidentiality,Aydar,,,,,,,
NPAC SMS shall use authentication of public encryption keys for users accessing the NPAC SMS over the Internet.,Security,npac.doc,1,Кирилл,,Confidentiality,Aydar,,,,,,,
NPAC SMS shall use smart cards to authenticate users accessing the NPAC SMS via dial-up.,Security,npac.doc,1,Кирилл,,Confidentiality,Aydar,,,,,,,
NPAC SMS shall provide a mechanism to end the session through secure logoff procedures.,Security,npac.doc,1,Кирилл,,Confidentiality,Aydar,,,,,,,
"NPAC SMS shall ensure that the message is NPAC SMS‑specifiable to meet their own requirements, and any applicable laws.",Security,npac.doc,1,Кирилл,,Confidentiality,Aydar,,,,,,,
NPAC SMS shall be able to display an advisory warning message of up to 20 lines in length prior to login.,Security,npac.doc,1,Кирилл,,Confidentiality,Aydar,,,,,,,
NPAC SMS shall default the pre-login advisory warning message to the following:,Security,npac.doc,1,Кирилл,,Confidentiality,Aydar,,,,,,,
NPAC SMS shall display the date and time of the user's last successful system access upon successful login.,Security,npac.doc,1,Кирилл,,Confidentiality,Aydar,,,,,,,
"NPAC SMS shall display the number of unsuccessful attempts by that userId to access the system, since the last successful access by that userId upon successful login.",Security,npac.doc,1,Кирилл,,Confidentiality,Aydar,,,,,,,
NPAC SMS shall only allow the NPAC Security Administrator to authorize users.,Security,npac.doc,1,Кирилл,,Confidentiality,Aydar,,,,,,,
NPAC SMS shall only allow the NPAC Security Administrator to revoke users.,Security,npac.doc,1,Кирилл,,Confidentiality,Aydar,,,,,,,
NPAC SMS shall provide security documentation that defines and describes procedures for adding users.,Security,npac.doc,1,Кирилл,,Operational,Aydar,Not sure,,,,,,
NPAC SMS shall provide security documentation that defines and describes procedures for deleting users.,Security,npac.doc,1,Кирилл,,Operational,Aydar,Not sure,,,,,,
NPAC SMS shall allow only authorized users to access the data that is part of or controlled by the SMS system.,Security,npac.doc,1,Кирилл,,Integrity,Aydar,,,,,,,
NPAC SMS shall protect service provider data from access by unauthorized users.,Security,npac.doc,1,Кирилл,,Integrity,Aydar,,,,,,,
NPAC SMS shall ensure that only NPAC system administrators can access the software files that constitute the NPAC SMS.,Security,npac.doc,1,Кирилл,,Integrity,Aydar,,,,,,,
NPAC SMS shall ensure that only authorized users can access the transactions that constitute the NPAC SMS.,Security,npac.doc,1,Кирилл,,Integrity,Aydar,,,,,,,
NPAC SMS shall ensure that only authorized NPAC Administrative and NPAC SOA Low-tech Interfaces users can access the data generated by the transactions that constitutes the SMS.,Security,npac.doc,1,Кирилл,,Integrity,Aydar,,,,,,,
"NPAC SMS shall ensure that the executable and loadable software is access controlled for overwrite and update, as well as execution rights.",Security,npac.doc,1,Кирилл,,Integrity,Aydar,,,,,,,
NPAC SMS shall ensure that control of access to resources is based on authenticated user identification.,Security,npac.doc,1,Кирилл,,Integrity,Aydar,,,,,,,
NPAC SMS shall ensure that userId and password is used as a primary access control for direct login and system ID is used for primary access control to the SOA to NPAC SMS interface and the NPAC SMS to Local SMS interface.,Security,npac.doc,1,Кирилл,,Confidentiality,Aydar,,,,,,,
"NPAC SMS shall ensure that for software resources controlled by NPAC SMS, it must be possible to grant access rights to a single user or a group of users.",Security,npac.doc,1,Кирилл,,Integrity,Aydar,,,,,,,
"NPAC SMS shall ensure that for software resources controlled by NPAC SMS, it must be possible to deny access rights to a single user or a group of users.",Security,npac.doc,1,Кирилл,,Integrity,Aydar,,,,,,,
NPAC SMS shall allow only NPAC personnel to modify access rights to a resource.,Security,npac.doc,1,Кирилл,,Integrity,Aydar,,,,,,,
NPAC SMS shall provide a mechanism to remove access rights to all software resources for a user or a group of users.,Security,npac.doc,1,Кирилл,,Integrity,Aydar,,,,,,,
NPAC SMS shall identify the originator of any accessible system resources.,Security,npac.doc,1,Кирилл,,Other,Aydar,Not sure,,,,,,
NPAC SMS shall be able to identify the originator of any information received across communication channels.,Security,npac.doc,1,Кирилл,,Other,Aydar,Not sure,,,,,,
NPAC SMS NMS shall use SNMP to monitor the system resources.,Security,npac.doc,1,Кирилл,,Accountability,Aydar,,,,,,,
NPAC SMS NMS shall use SNMP to detect error conditions.,Security,npac.doc,1,Кирилл,,Accountability,Aydar,,,,,,,
NPAC SMS NMS shall use SNMP to detect communication errors.,Security,npac.doc,1,Кирилл,,Accountability,Aydar,Not sure,,,,,,
NPAC SMS NMS shall use SNMP to detect link outages.,Security,npac.doc,1,Кирилл,,Availability,Aydar,Not sure,,,,,,
NPAC SMS shall ensure proper rule checking on data update.,Security,npac.doc,1,Кирилл,,Confidentiality,Aydar,,,,,,,
NPAC SMS shall handle duplicate/multiple inputs.,Security,npac.doc,1,Кирилл,,Integrity,Aydar,,,,,,,
